{
  "schema_version": 2,
  "_note": "REQ-G-011 侦查维度声明（庙算多维覆盖度模型）。DIMENSIONS 不再硬编码于 core/hypotheses.py，改由本文件声明。**code 为机器标识符（rules.json / hypothesis_patterns.json 一律引用 code），name 仅作展示名（UI/报告）**——此前用中文 name 当标识符，换领域时维度名变更会同时打断引用链与展示，且无稳定主键。装载期交叉校验：引用必须是已声明的 code；未声明硬失败。新增维度不改 Python 即可被规则引用并参与覆盖度。source_object_types 为该维度证据来源的语义对象（元数据，供溯源）。P-GEO 新增 space 维：空间证据此前混记在 behavior 名下，导致 lnk_co_located 真缺口被 geo 命中掩盖——拆开后两维各自诚实。P-ITEM：**不为物品新增第 7 维**——物品证据散落各维（车轨迹属 space、发票流转属 fund、手机属 comm、房产车产关联属 relation），单开一维会使六维覆盖度模型失真且稀释既有维度语义。故按本文件既有范式，把 item 补进相关维度的 source_object_types。behavior / time 不加：行为属人的活动规律，物品无「行为」；time 是横切维，来源是事件性对象（交易/通话/轨迹点），物品本身不构成时间证据。",
  "_compat": "code 缺失的旧维度声明，装载期自动取 name 作为 code（fallback），保证旧案件包零行为变化；新声明必须显式给 code。",
  "dimensions": [
    {"code": "fund", "name": "资金", "note": "银行流水/资金往来异常", "source_object_types": ["transaction", "item"]},
    {"code": "comm", "name": "通讯", "note": "通话/联系频次与对象", "source_object_types": ["call", "item"]},
    {"code": "behavior", "name": "行为", "note": "行为模式/活动规律（文本轨迹同框等关系性事实）", "source_object_types": ["trackpoint"]},
    {"code": "space", "name": "空间", "note": "空间关系与地理分布：同框/伴随/缓冲环带/聚集画像（需坐标支撑）", "source_object_types": ["trackpoint", "location", "item"]},
    {"code": "relation", "name": "关系", "note": "工商/社会关系网络", "source_object_types": ["person", "org", "item"]},
    {"code": "time", "name": "时间", "note": "时间耦合/先后顺序（跨对象属性）", "source_object_types": ["transaction", "call", "trackpoint"]}
  ]
}
